{
  "$schema": "./schemas/leeos.schema.json",
  "systemId": "leeos",
  "name": "LeeOS",
  "version": "0.18.1",
  "structure": 18,
  "costPolicy": "ZERO_ONLY",
  "defaultExecution": "disabled",
  "hub": "apps/hub",
  "core": "packages/core",
  "modules": {
    "providers": "packages/providers",
    "executors": "packages/executors",
    "agents": "packages/agents",
    "automations": "packages/automations",
    "ui": "packages/ui",
    "database": "packages/database"
  },
  "plannedIntegrations": [
    "n8n",
    "python",
    "lee360"
  ],
  "implemented": [
    "hub",
    "health-api",
    "core-status",
    "adapter-contracts",
    "postgresql-state-schema",
    "versioned-migrations",
    "transactional-state-store",
    "database-readiness",
    "validated-core-commands",
    "local-owner-api",
    "versioned-state-api",
    "operator-cli",
    "deterministic-task-planning",
    "immutable-run-plans",
    "capability-routing",
    "provider-metadata-contracts",
    "deterministic-model-routing",
    "zero-cost-eligibility",
    "model-routing-api",
    "executor-metadata-adapter",
    "review-bound-job-preparation",
    "transactional-job-batches",
    "dependency-inspection",
    "immutable-agent-roles",
    "job-scoped-agent-assignments",
    "assignment-permission-boundary",
    "agent-dismissal-lifecycle",
    "local-llamacpp-adapter",
    "bounded-owner-model-calls",
    "durable-provider-reservation",
    "provider-call-usage-and-recovery",
    "owner-authorized-local-job-execution",
    "dependency-and-agent-execution-fencing",
    "job-result-reconciliation",
    "explicit-owner-review",
    "one-time-and-fixed-interval-schedules",
    "local-once-daily-weekly-calendar-schedules",
    "iana-timezone-validation-and-calendar-resolution",
    "deterministic-daylight-saving-gap-and-repeat-policy",
    "immutable-calendar-occurrence-receipts",
    "calendar-missed-occurrence-coalescing",
    "queue-only-scheduled-owner-review",
    "durable-event-subscriptions",
    "transactional-trigger-receipts",
    "bounded-local-coordination-poller",
    "missed-interval-coalescing",
    "trigger-overlap-suppression",
    "bounded-english-request-intake",
    "immutable-proposal-revisions",
    "review-bound-request-approval",
    "request-to-queued-run-and-plan",
    "general-purpose-hub-workbench",
    "memory-only-owner-connection",
    "hub-request-plan-review-flow",
    "hub-job-approval-and-results",
    "read-only-hub-run-recovery",
    "bounded-connection-error-messages",
    "static-only-offline-fallback",
    "pwa-install-and-update-guidance",
    "hub-schedule-event-management",
    "explicit-system-wide-hub-coordination-check",
    "hub-reusable-sequence-definitions",
    "reviewed-hub-planning-for-unplanned-runs",
    "read-only-local-setup-status",
    "hub-local-operation-guide",
    "shared-local-v1-acceptance-contract",
    "versioned-requirements-contracts",
    "reviewed-run-requirements-snapshots",
    "scoped-acceptance-evidence",
    "goal-acceptance-read-model",
    "contract-driven-capability-planning",
    "requirement-capability-coverage",
    "server-owned-capability-selection",
    "hub-capability-planning",
    "durable-execution-envelopes",
    "exact-envelope-owner-authorization",
    "append-only-envelope-revocation",
    "hub-envelope-preview-and-recovery",
    "independent-envelope-worker",
    "database-clock-leases-and-fencing",
    "durable-envelope-operation-results",
    "conservative-worker-recovery",
    "explicit-envelope-human-review",
    "github-actions-public-runner-worker",
    "gemini-free-tier-text-adapter",
    "live-google-project-billing-gate",
    "gemini-api-key-service-restriction-check",
    "remote-provider-usage-cost-evidence",
    "remote-uncertain-call-no-retry-recovery",
    "durable-postgresql-artifact-bytes",
    "project-scoped-artifact-retrieval",
    "artifact-content-integrity-verification",
    "idempotent-artifact-registration",
    "fenced-worker-artifact-registration",
    "python-docx-specialist",
    "independent-docx-content-and-format-validation",
    "docx-artifact-bound-acceptance-evidence",
    "generic-email-send-operation",
    "resend-email-provider-adapter",
    "owner-attested-zero-cost-email-route",
    "durable-external-effect-identities-and-receipts",
    "signed-resend-delivery-webhooks",
    "delivery-bound-acceptance-evidence",
    "versioned-project-and-automation-lifecycle",
    "pause-resume-archive-trigger-controls",
    "reviewed-structured-owner-project-automation-memory",
    "tag-targeted-scope-authorized-memory-retrieval",
    "project-command-center-read-model",
    "hub-attention-goal-run-schedule-artifact-visibility"
  ],
  "deferred": [
    "live-agents",
    "additional-cloud-model-providers",
    "autonomous-agent-loops",
    "external-executor-launch",
    "advanced-cron-and-monthly-recurrence",
    "external-webhook-triggers",
    "general-language-model-planning",
    "automatic-source-file-reading",
    "automatic-memory-injection-into-plans",
    "automatic-build-test-fix-deploy",
    "learning-feedback-loop",
    "general-goal-implementation-discovery",
    "remote-worker-artifact-live-e2e",
    "remote-docx-live-e2e",
    "artifact-retention-and-deletion-controls",
    "hosted-email-delivery-e2e",
    "live-resend-billing-and-webhook-verification"
  ],
  "implementationMilestone": "P1.5"
}
